[
  {
    "strategy_id": "strat_0001",
    "strategy_category": "moderate_cut",
    "male_population": "trained natural males with moderate body fat",
    "training_status": "intermediate",
    "starting_body_fat_context": "moderate",
    "nutrition_phase": "deficit",
    "calorie_adjustment_type": "percent_maintenance",
    "recommended_calorie_adjustment_low": -20,
    "recommended_calorie_adjustment_high": -10,
    "calorie_adjustment_unit": "percent",
    "target_weight_change_rate_low": -0.75,
    "target_weight_change_rate_high": -0.25,
    "weight_change_rate_unit": "percent_body_weight_per_week",
    "protein_g_per_kg_low": 1.8,
    "protein_g_per_kg_high": 2.4,
    "fat_g_per_kg_low": 0.6,
    "fat_g_per_kg_high": 1,
    "carbohydrate_guidance": "Allocate remaining calories to carbohydrate; place a meaningful portion around training when useful.",
    "training_volume_adjustment": "Retain productive volume; reduce 0-20% only if recovery declines.",
    "training_intensity_adjustment": "Retain moderate/heavy load exposure and target RIR.",
    "cardio_guidance": "Use the minimum cardio needed; increase gradually.",
    "recovery_guidance": "Prioritize sleep and manage rate of loss.",
    "expected_outcome": "Primarily fat loss with better lean-mass retention than aggressive restriction",
    "monitoring_metrics": "7_day_weight_average|waist|training_performance|hunger|sleep",
    "adjustment_triggers": "If loss exceeds target for 2 weeks or multi-lift performance declines, add calories or reduce fatigue.",
    "recommended_duration": "6-16 weeks",
    "contraindications_or_exceptions": "Avoid aggressive restriction when already very lean, medically contraindicated, or showing low energy availability.",
    "evidence_strength": "high",
    "confidence_rating": "moderate",
    "supporting_study_ids": "stu_0018|stu_0019|stu_0020",
    "notes": "Ranges are application defaults, not individualized medical nutrition prescriptions."
  },
  {
    "strategy_id": "strat_0002",
    "strategy_category": "higher_body_fat_cut",
    "male_population": "higher-body-fat resistance-training-eligible males",
    "training_status": "novice",
    "starting_body_fat_context": "high",
    "nutrition_phase": "deficit",
    "calorie_adjustment_type": "percent_maintenance",
    "recommended_calorie_adjustment_low": -25,
    "recommended_calorie_adjustment_high": -15,
    "calorie_adjustment_unit": "percent",
    "target_weight_change_rate_low": -1,
    "target_weight_change_rate_high": -0.5,
    "weight_change_rate_unit": "percent_body_weight_per_week",
    "protein_g_per_kg_low": 1.6,
    "protein_g_per_kg_high": 2.2,
    "fat_g_per_kg_low": 0.6,
    "fat_g_per_kg_high": 1,
    "carbohydrate_guidance": "Carbohydrate based on preference and training performance after protein/fat targets.",
    "training_volume_adjustment": "Start at normal novice volume; avoid adding volume solely to burn calories.",
    "training_intensity_adjustment": "Progress where possible; stable strength is not the ceiling in novices.",
    "cardio_guidance": "Low-impact cardio may support the deficit.",
    "recovery_guidance": "Monitor joint tolerance, sleep, and adherence.",
    "expected_outcome": "Substantial fat loss with reasonable recomposition potential",
    "monitoring_metrics": "weight_trend|waist|photos|strength|reps|rir",
    "adjustment_triggers": "Reduce deficit if loss exceeds 1%/week repeatedly or recovery deteriorates.",
    "recommended_duration": "8-24 weeks with maintenance breaks as needed",
    "contraindications_or_exceptions": "Medical obesity or comorbidities may require clinician-led nutrition care.",
    "evidence_strength": "moderate",
    "confidence_rating": "moderate",
    "supporting_study_ids": "stu_0019|stu_0021|stu_0023",
    "notes": "Ranges are application defaults, not individualized medical nutrition prescriptions."
  },
  {
    "strategy_id": "strat_0003",
    "strategy_category": "lean_advanced_cut",
    "male_population": "lean advanced natural males",
    "training_status": "advanced",
    "starting_body_fat_context": "low",
    "nutrition_phase": "deficit",
    "calorie_adjustment_type": "percent_maintenance",
    "recommended_calorie_adjustment_low": -15,
    "recommended_calorie_adjustment_high": -5,
    "calorie_adjustment_unit": "percent",
    "target_weight_change_rate_low": -0.5,
    "target_weight_change_rate_high": -0.25,
    "weight_change_rate_unit": "percent_body_weight_per_week",
    "protein_g_per_kg_low": 2,
    "protein_g_per_kg_high": 2.4,
    "fat_g_per_kg_low": 0.7,
    "fat_g_per_kg_high": 1,
    "carbohydrate_guidance": "Preserve carbohydrate around demanding sessions when possible.",
    "training_volume_adjustment": "Retain high-value sets; reduce 10-30% when repeated recovery issues occur.",
    "training_intensity_adjustment": "Keep load exposure but avoid excessive failure work.",
    "cardio_guidance": "Conservative low-impact cardio; avoid abrupt increases.",
    "recovery_guidance": "Watch mood, libido, sleep, resting heart rate, and persistent performance loss.",
    "expected_outcome": "Slow fat loss with reduced but not eliminated lean-mass risk",
    "monitoring_metrics": "weight_trend|performance|sleep|libido|mood|hunger",
    "adjustment_triggers": "Stop or use maintenance if low-energy-availability symptoms or persistent regressions emerge.",
    "recommended_duration": "4-12 weeks",
    "contraindications_or_exceptions": "Contest-level leanness carries health risks and is outside general fitness recommendations.",
    "evidence_strength": "moderate",
    "confidence_rating": "moderate",
    "supporting_study_ids": "stu_0018|stu_0019",
    "notes": "Ranges are application defaults, not individualized medical nutrition prescriptions."
  },
  {
    "strategy_id": "strat_0004",
    "strategy_category": "maintenance_phase",
    "male_population": "all healthy natural males",
    "training_status": "all",
    "starting_body_fat_context": "all",
    "nutrition_phase": "maintenance",
    "calorie_adjustment_type": "percent_maintenance",
    "recommended_calorie_adjustment_low": -3,
    "recommended_calorie_adjustment_high": 3,
    "calorie_adjustment_unit": "percent",
    "target_weight_change_rate_low": -0.1,
    "target_weight_change_rate_high": 0.1,
    "weight_change_rate_unit": "percent_body_weight_per_week",
    "protein_g_per_kg_low": 1.6,
    "protein_g_per_kg_high": 2.2,
    "fat_g_per_kg_low": 0.6,
    "fat_g_per_kg_high": 1.2,
    "carbohydrate_guidance": "Adjust carbohydrate to activity and training quality.",
    "training_volume_adjustment": "Use productive or maintenance volume according to goal.",
    "training_intensity_adjustment": "Progress normally when recovery supports it.",
    "cardio_guidance": "Cardio for health and work capacity without compromising lifting.",
    "recovery_guidance": "Use stable weight to calibrate energy needs over at least 2 weeks.",
    "expected_outcome": "Weight stability with performance recovery or slow recomp",
    "monitoring_metrics": "14_day_weight_trend|waist|performance|recovery",
    "adjustment_triggers": "Adjust calories 3-5% after at least 2 weeks outside desired weight band.",
    "recommended_duration": "2-8 weeks or indefinite",
    "contraindications_or_exceptions": "Short-term water shifts can mimic energy imbalance.",
    "evidence_strength": "moderate",
    "confidence_rating": "high",
    "supporting_study_ids": "stu_0016|stu_0019",
    "notes": "Ranges are application defaults, not individualized medical nutrition prescriptions."
  },
  {
    "strategy_id": "strat_0005",
    "strategy_category": "novice_recomposition",
    "male_population": "untrained or novice natural males",
    "training_status": "novice",
    "starting_body_fat_context": "moderate_to_high",
    "nutrition_phase": "recomposition",
    "calorie_adjustment_type": "percent_maintenance",
    "recommended_calorie_adjustment_low": -15,
    "recommended_calorie_adjustment_high": 0,
    "calorie_adjustment_unit": "percent",
    "target_weight_change_rate_low": -0.75,
    "target_weight_change_rate_high": 0,
    "weight_change_rate_unit": "percent_body_weight_per_week",
    "protein_g_per_kg_low": 1.6,
    "protein_g_per_kg_high": 2.2,
    "fat_g_per_kg_low": 0.6,
    "fat_g_per_kg_high": 1,
    "carbohydrate_guidance": "Support progressive training with sufficient carbohydrate.",
    "training_volume_adjustment": "Use a recoverable novice program, not high-volume specialization.",
    "training_intensity_adjustment": "Expect rep/load progression despite stable or falling scale weight.",
    "cardio_guidance": "Optional; prioritize resistance training.",
    "recovery_guidance": "Sleep 7-9 hours when feasible and maintain consistency.",
    "expected_outcome": "Fat loss with simultaneous lean-mass gain is plausible",
    "monitoring_metrics": "waist|photos|strength|reps|weight_trend",
    "adjustment_triggers": "If waist and performance both stagnate 3-4 weeks, adjust calories or program after adherence audit.",
    "recommended_duration": "8-24 weeks",
    "contraindications_or_exceptions": "Do not promise recomposition magnitude; measurement error is substantial.",
    "evidence_strength": "moderate",
    "confidence_rating": "moderate",
    "supporting_study_ids": "stu_0021|stu_0023",
    "notes": "Ranges are application defaults, not individualized medical nutrition prescriptions."
  },
  {
    "strategy_id": "strat_0006",
    "strategy_category": "detrained_recomposition",
    "male_population": "previously trained detrained natural males",
    "training_status": "intermediate",
    "starting_body_fat_context": "all",
    "nutrition_phase": "recomposition",
    "calorie_adjustment_type": "percent_maintenance",
    "recommended_calorie_adjustment_low": -10,
    "recommended_calorie_adjustment_high": 5,
    "calorie_adjustment_unit": "percent",
    "target_weight_change_rate_low": -0.5,
    "target_weight_change_rate_high": 0.25,